{
  "schema": "chronicle.canonical-catalog",
  "version": "0.1",
  "canonical_entities": [
    {
      "canonical_id": "01a05cd7-439d-7000-933c-d13d77a9dc37",
      "representations": [
        {
          "bundle": "wuzhu",
          "ref": "ent_033"
        }
      ]
    },
    {
      "canonical_id": "01a05cd7-439d-70b8-ad1f-6e94af9a9221",
      "representations": [
        {
          "bundle": "wuzhu",
          "ref": "ent_006"
        }
      ]
    },
    {
      "canonical_id": "01a05cd7-439d-70bd-ba1f-dc7767e29936",
      "representations": [
        {
          "bundle": "wuzhu",
          "ref": "ent_038"
        }
      ]
    },
    {
      "canonical_id": "01a05cd7-439d-715a-a3ac-3975f377a45d",
      "representations": [
        {
          "bundle": "wudi",
          "ref": "ent_028"
        }
      ]
    },
    {
      "canonical_id": "01a05cd7-439d-7172-b459-8d0c0747f5f2",
      "representations": [
        {
          "bundle": "wudi",
          "ref": "ent_001"
        },
        {
          "bundle": "wuzhu",
          "ref": "ent_017"
        }
      ]
    },
    {
      "canonical_id": "01a05cd7-439d-7195-bc23-e114425cb4cd",
      "representations": [
        {
          "bundle": "wuzhu",
          "ref": "ent_002"
        }
      ]
    },
    {
      "canonical_id": "01a05cd7-439d-71a9-9657-b6554e41eb08",
      "representations": [
        {
          "bundle": "wudi",
          "ref": "ent_011"
        }
      ]
    },
    {
      "canonical_id": "01a05cd7-439d-7209-94b2-22a7f1573904",
      "representations": [
        {
          "bundle": "wuzhu",
          "ref": "ent_008"
        }
      ]
    },
    {
      "canonical_id": "01a05cd7-439d-7244-a67c-f73e1d0a9006",
      "representations": [
        {
          "bundle": "wuzhu",
          "ref": "ent_025"
        }
      ]
    },
    {
      "canonical_id": "01a05cd7-439d-7250-bf58-14e063569726",
      "representations": [
        {
          "bundle": "wuzhu",
          "ref": "ent_030"
        }
      ]
    },
    {
      "canonical_id": "01a05cd7-439d-728a-9582-a1e22e6f13ef",
      "representations": [
        {
          "bundle": "wudi",
          "ref": "ent_006"
        }
      ]
    },
    {
      "canonical_id": "01a05cd7-439d-72e9-a5f9-fe026c7fa9ab",
      "representations": [
        {
          "bundle": "wuzhu",
          "ref": "ent_010"
        }
      ]
    },
    {
      "canonical_id": "01a05cd7-439d-735d-979a-bdd073d824cc",
      "representations": [
        {
          "bundle": "wudi",
          "ref": "ent_012"
        }
      ]
    },
    {
      "canonical_id": "01a05cd7-439d-7399-b741-2d75ed9fa72e",
      "representations": [
        {
          "bundle": "wuzhu",
          "ref": "ent_005"
        }
      ]
    },
    {
      "canonical_id": "01a05cd7-439d-73c7-a2c6-30dc7e4372d9",
      "representations": [
        {
          "bundle": "wuzhu",
          "ref": "ent_022"
        }
      ]
    },
    {
      "canonical_id": "01a05cd7-439d-743f-b2ca-3c524f89ac0d",
      "representations": [
        {
          "bundle": "wuzhu",
          "ref": "ent_040"
        }
      ]
    },
    {
      "canonical_id": "01a05cd7-439d-74ce-8654-370ac9d57370",
      "representations": [
        {
          "bundle": "wudi",
          "ref": "ent_029"
        }
      ]
    },
    {
      "canonical_id": "01a05cd7-439d-74e5-bc85-8bc2ca40fb40",
      "representations": [
        {
          "bundle": "wuzhu",
          "ref": "ent_037"
        }
      ]
    },
    {
      "canonical_id": "01a05cd7-439d-757f-a7d6-9165121cdd07",
      "representations": [
        {
          "bundle": "wuzhu",
          "ref": "ent_020"
        }
      ]
    },
    {
      "canonical_id": "01a05cd7-439d-7594-9bc8-2f32480b97a4",
      "representations": [
        {
          "bundle": "wudi",
          "ref": "ent_013"
        }
      ]
    },
    {
      "canonical_id": "01a05cd7-439d-75b4-a91c-f593feccdf29",
      "representations": [
        {
          "bundle": "wuzhu",
          "ref": "ent_009"
        }
      ]
    },
    {
      "canonical_id": "01a05cd7-439d-7606-b619-24ee5ceb009f",
      "representations": [
        {
          "bundle": "wuzhu",
          "ref": "ent_024"
        }
      ]
    },
    {
      "canonical_id": "01a05cd7-439d-7636-acb6-0b6f25698e0f",
      "representations": [
        {
          "bundle": "wuzhu",
          "ref": "ent_003"
        }
      ]
    },
    {
      "canonical_id": "01a05cd7-439d-764e-923f-9b9f9e8c3add",
      "representations": [
        {
          "bundle": "wudi",
          "ref": "ent_031"
        }
      ]
    },
    {
      "canonical_id": "01a05cd7-439d-766f-bc24-577035c9bb30",
      "representations": [
        {
          "bundle": "wudi",
          "ref": "ent_021"
        }
      ]
    },
    {
      "canonical_id": "01a05cd7-439d-7674-b9ca-41a684421b9f",
      "representations": [
        {
          "bundle": "wudi",
          "ref": "ent_008"
        }
      ]
    },
    {
      "canonical_id": "01a05cd7-439d-768d-af69-9c5dc59927a0",
      "representations": [
        {
          "bundle": "wudi",
          "ref": "ent_027"
        }
      ]
    },
    {
      "canonical_id": "01a05cd7-439d-769a-b956-d0b4957825fd",
      "representations": [
        {
          "bundle": "wudi",
          "ref": "ent_004"
        },
        {
          "bundle": "wuzhu",
          "ref": "ent_019"
        }
      ]
    },
    {
      "canonical_id": "01a05cd7-439d-7761-b858-ae54bcabb1d1",
      "representations": [
        {
          "bundle": "wuzhu",
          "ref": "ent_011"
        }
      ]
    },
    {
      "canonical_id": "01a05cd7-439d-778a-a957-e99e7368a13a",
      "representations": [
        {
          "bundle": "wudi",
          "ref": "ent_017"
        }
      ]
    },
    {
      "canonical_id": "01a05cd7-439d-7824-b8b4-ad34ddb68a2d",
      "representations": [
        {
          "bundle": "wuzhu",
          "ref": "ent_039"
        }
      ]
    },
    {
      "canonical_id": "01a05cd7-439d-782d-8ed4-2d7012ff0935",
      "representations": [
        {
          "bundle": "wudi",
          "ref": "ent_003"
        },
        {
          "bundle": "wuzhu",
          "ref": "ent_018"
        }
      ]
    },
    {
      "canonical_id": "01a05cd7-439d-7890-bb40-575f2a0f753c",
      "representations": [
        {
          "bundle": "wudi",
          "ref": "ent_002"
        },
        {
          "bundle": "wuzhu",
          "ref": "ent_015"
        }
      ]
    },
    {
      "canonical_id": "01a05cd7-439d-78bf-9cf7-28f2f7f5ab83",
      "representations": [
        {
          "bundle": "wuzhu",
          "ref": "ent_035"
        }
      ]
    },
    {
      "canonical_id": "01a05cd7-439d-7982-9677-97dd49d6a2bf",
      "representations": [
        {
          "bundle": "wuzhu",
          "ref": "ent_031"
        }
      ]
    },
    {
      "canonical_id": "01a05cd7-439d-7994-bbb9-797dbdaca0b5",
      "representations": [
        {
          "bundle": "wudi",
          "ref": "ent_026"
        }
      ]
    },
    {
      "canonical_id": "01a05cd7-439d-7ad7-9d93-37123940244d",
      "representations": [
        {
          "bundle": "wudi",
          "ref": "ent_025"
        }
      ]
    },
    {
      "canonical_id": "01a05cd7-439d-7b25-b7b9-7570f0df0337",
      "representations": [
        {
          "bundle": "wuzhu",
          "ref": "ent_032"
        }
      ]
    },
    {
      "canonical_id": "01a05cd7-439d-7b50-92d5-cbdf414973cf",
      "representations": [
        {
          "bundle": "wuzhu",
          "ref": "ent_004"
        }
      ]
    },
    {
      "canonical_id": "01a05cd7-439d-7b50-9cc6-a688f5377c14",
      "representations": [
        {
          "bundle": "wuzhu",
          "ref": "ent_034"
        }
      ]
    },
    {
      "canonical_id": "01a05cd7-439d-7b8c-9e49-d18f09b5358a",
      "representations": [
        {
          "bundle": "wudi",
          "ref": "ent_019"
        }
      ]
    },
    {
      "canonical_id": "01a05cd7-439d-7bc9-8dc9-d8640614140f",
      "representations": [
        {
          "bundle": "wudi",
          "ref": "ent_022"
        }
      ]
    },
    {
      "canonical_id": "01a05cd7-439d-7bce-8c9d-077782a9fab6",
      "representations": [
        {
          "bundle": "wuzhu",
          "ref": "ent_028"
        }
      ]
    },
    {
      "canonical_id": "01a05cd7-439d-7bd8-af03-35b7a2d3c48f",
      "representations": [
        {
          "bundle": "wuzhu",
          "ref": "ent_036"
        }
      ]
    },
    {
      "canonical_id": "01a05cd7-439d-7c22-846a-83df61d881ab",
      "representations": [
        {
          "bundle": "wudi",
          "ref": "ent_024"
        }
      ]
    },
    {
      "canonical_id": "01a05cd7-439d-7c39-b088-89e7d6d7ed5f",
      "representations": [
        {
          "bundle": "wuzhu",
          "ref": "ent_013"
        }
      ]
    },
    {
      "canonical_id": "01a05cd7-439d-7c3c-a7ba-2faad43e3f9f",
      "representations": [
        {
          "bundle": "wuzhu",
          "ref": "ent_014"
        }
      ]
    },
    {
      "canonical_id": "01a05cd7-439d-7c44-bd74-4c175382a968",
      "representations": [
        {
          "bundle": "wudi",
          "ref": "ent_018"
        }
      ]
    },
    {
      "canonical_id": "01a05cd7-439d-7c7f-9b79-d75177718c39",
      "representations": [
        {
          "bundle": "wuzhu",
          "ref": "ent_023"
        }
      ]
    },
    {
      "canonical_id": "01a05cd7-439d-7c8b-9c2c-91dbb6b5ad3b",
      "representations": [
        {
          "bundle": "wudi",
          "ref": "ent_023"
        }
      ]
    },
    {
      "canonical_id": "01a05cd7-439d-7ca4-96bb-5a059ecb60f0",
      "representations": [
        {
          "bundle": "wudi",
          "ref": "ent_014"
        }
      ]
    },
    {
      "canonical_id": "01a05cd7-439d-7ca8-a263-11ec915ee0a2",
      "representations": [
        {
          "bundle": "wudi",